{
  "$schema": "../component.schema.json",
  "schemaVersion": 1,
  "pluginVersion": "4.1.0.0",
  "ghaSha256": "700C1620FD839DD1511E67359961787C8EC08EA595812B2EDED27828F96800C5",
  "component": {
    "name": "Particle Trail Preview",
    "category": "Nuclei4",
    "subcategory": "Preview",
    "componentGuid": "b17ecf97-0425-4ae2-a6b0-b3f869a5bc72",
    "dotnetType": "Nuclei4.Preview_Particle_Trails_GPU",
    "inputs": [
      {
        "index": 0,
        "name": "Particles",
        "nickname": "particles",
        "ghType": "Generic Data",
        "access": "item",
        "optional": false,
        "mapping": "None",
        "defaults": []
      },
      {
        "index": 1,
        "name": "Alpha",
        "nickname": "alpha",
        "ghType": "Number",
        "access": "item",
        "optional": true,
        "mapping": "None",
        "defaults": [
          "0.35"
        ]
      },
      {
        "index": 2,
        "name": "Depth Focus",
        "nickname": "depth",
        "ghType": "Number",
        "access": "item",
        "optional": true,
        "mapping": "None",
        "defaults": [
          "0.55"
        ]
      }
    ],
    "outputs": []
  }
}
