{
  "$schema": "../component.schema.json",
  "schemaVersion": 1,
  "pluginVersion": "4.1.0.0",
  "ghaSha256": "700C1620FD839DD1511E67359961787C8EC08EA595812B2EDED27828F96800C5",
  "component": {
    "name": "Define Discrete Vectors",
    "category": "Nuclei4",
    "subcategory": " Environment",
    "componentGuid": "c4f37772-d03a-44a5-bd50-755442b1c5f3",
    "dotnetType": "Nuclei4.Voxel_Vectors_Discretize",
    "inputs": [
      {
        "index": 0,
        "name": "Voxel Discrete Vectors",
        "nickname": "discreteVectors",
        "ghType": "Vector",
        "access": "list",
        "optional": false,
        "mapping": "Flatten",
        "defaults": []
      }
    ],
    "outputs": [
      {
        "index": 0,
        "name": "Discrete Vector Settings",
        "nickname": "discreteSettings",
        "ghType": "Text",
        "access": "list",
        "optional": false,
        "mapping": "None",
        "defaults": []
      }
    ]
  }
}
