{
  "$schema": "../component.schema.json",
  "schemaVersion": 1,
  "pluginVersion": "4.1.0.0",
  "ghaSha256": "700C1620FD839DD1511E67359961787C8EC08EA595812B2EDED27828F96800C5",
  "component": {
    "name": "Extract Particle Positions",
    "category": "Nuclei4",
    "subcategory": " Particles",
    "componentGuid": "f11f6319-1d69-4c97-8734-17c3f6a13b4a",
    "dotnetType": "Nuclei4.Particle_Extractor_Point",
    "inputs": [
      {
        "index": 0,
        "name": "Particles",
        "nickname": "particles",
        "ghType": "Generic Data",
        "access": "item",
        "optional": false,
        "mapping": "None",
        "defaults": []
      }
    ],
    "outputs": [
      {
        "index": 0,
        "name": "Particle Positions",
        "nickname": "particlePos",
        "ghType": "Point",
        "access": "list",
        "optional": false,
        "mapping": "None",
        "defaults": []
      }
    ]
  }
}
