{
  "$schema": "../component.schema.json",
  "schemaVersion": 1,
  "pluginVersion": "4.1.0.0",
  "ghaSha256": "700C1620FD839DD1511E67359961787C8EC08EA595812B2EDED27828F96800C5",
  "component": {
    "name": "Nuclei4 to Dendro Volume",
    "category": "Nuclei4",
    "subcategory": "Voxels",
    "componentGuid": "2cc99696-1f20-4add-82d5-a317c252edb8",
    "dotnetType": "Nuclei4.GpuVolumeToMesh",
    "inputs": [
      {
        "index": 0,
        "name": "Voxels",
        "nickname": "voxels",
        "ghType": "Generic Data",
        "access": "item",
        "optional": false,
        "mapping": "None",
        "defaults": []
      },
      {
        "index": 1,
        "name": "Type",
        "nickname": "type",
        "ghType": "Integer",
        "access": "item",
        "optional": false,
        "mapping": "None",
        "defaults": [
          "7"
        ]
      },
      {
        "index": 2,
        "name": "Iso Value",
        "nickname": "iso",
        "ghType": "Number",
        "access": "item",
        "optional": false,
        "mapping": "None",
        "defaults": [
          "0.8"
        ]
      },
      {
        "index": 3,
        "name": "Method",
        "nickname": "method",
        "ghType": "Integer",
        "access": "item",
        "optional": false,
        "mapping": "None",
        "defaults": [
          "0"
        ]
      },
      {
        "index": 4,
        "name": "Maximum Elements",
        "nickname": "max",
        "ghType": "Integer",
        "access": "item",
        "optional": false,
        "mapping": "None",
        "defaults": [
          "5000000"
        ]
      },
      {
        "index": 5,
        "name": "Update",
        "nickname": "update",
        "ghType": "Boolean",
        "access": "item",
        "optional": false,
        "mapping": "None",
        "defaults": [
          "False"
        ]
      },
      {
        "index": 6,
        "name": "Smoothing Iterations",
        "nickname": "smooth",
        "ghType": "Integer",
        "access": "item",
        "optional": false,
        "mapping": "None",
        "defaults": [
          "1"
        ]
      }
    ],
    "outputs": [
      {
        "index": 0,
        "name": "Dendro Volume / Mesh",
        "nickname": "volume",
        "ghType": "Generic Data",
        "access": "item",
        "optional": false,
        "mapping": "None",
        "defaults": []
      }
    ]
  }
}
