{
  "$schema": "../component.schema.json",
  "schemaVersion": 1,
  "pluginVersion": "4.1.0.0",
  "ghaSha256": "700C1620FD839DD1511E67359961787C8EC08EA595812B2EDED27828F96800C5",
  "component": {
    "name": "Extract Particle Neighbour Count",
    "category": "Nuclei4",
    "subcategory": " Particles",
    "componentGuid": "d077c7a9-1db6-410c-87f9-917a0c3a353d",
    "dotnetType": "Nuclei4.Particle_Extractor_NeighbourCount",
    "inputs": [
      {
        "index": 0,
        "name": "Particles",
        "nickname": "particles",
        "ghType": "Generic Data",
        "access": "item",
        "optional": false,
        "mapping": "None",
        "defaults": []
      }
    ],
    "outputs": [
      {
        "index": 0,
        "name": "Particle Neighbour Count",
        "nickname": "particleNC",
        "ghType": "Number",
        "access": "list",
        "optional": false,
        "mapping": "None",
        "defaults": []
      }
    ]
  }
}
