{
  "$schema": "../component.schema.json",
  "schemaVersion": 1,
  "pluginVersion": "4.1.0.0",
  "ghaSha256": "700C1620FD839DD1511E67359961787C8EC08EA595812B2EDED27828F96800C5",
  "component": {
    "name": "Function Attractor",
    "category": "Nuclei4",
    "subcategory": " Environment",
    "componentGuid": "99408ead-53f2-4ecb-8d3d-afd2f4dca58c",
    "dotnetType": "Nuclei4.Voxel_PeriodicSurface",
    "inputs": [
      {
        "index": 0,
        "name": "Voxels",
        "nickname": "voxels",
        "ghType": "Generic Data",
        "access": "item",
        "optional": false,
        "mapping": "None",
        "defaults": []
      },
      {
        "index": 1,
        "name": "Surface",
        "nickname": "surface",
        "ghType": "Integer",
        "access": "item",
        "optional": true,
        "mapping": "None",
        "defaults": [
          "1"
        ]
      },
      {
        "index": 2,
        "name": "Custom",
        "nickname": "custom",
        "ghType": "Text",
        "access": "item",
        "optional": true,
        "mapping": "None",
        "defaults": [
          ""
        ]
      },
      {
        "index": 3,
        "name": "Scale",
        "nickname": "scale",
        "ghType": "Number",
        "access": "item",
        "optional": false,
        "mapping": "None",
        "defaults": [
          "2.0 * Pi"
        ]
      },
      {
        "index": 4,
        "name": "Iso Value",
        "nickname": "isoValue",
        "ghType": "Number",
        "access": "item",
        "optional": false,
        "mapping": "None",
        "defaults": [
          "0"
        ]
      },
      {
        "index": 5,
        "name": "Minimum Range",
        "nickname": "minRange",
        "ghType": "Number",
        "access": "item",
        "optional": false,
        "mapping": "None",
        "defaults": [
          "0"
        ]
      },
      {
        "index": 6,
        "name": "Maximum Range",
        "nickname": "maxRange",
        "ghType": "Number",
        "access": "item",
        "optional": false,
        "mapping": "None",
        "defaults": [
          "2"
        ]
      }
    ],
    "outputs": [
      {
        "index": 0,
        "name": "Output Voxels",
        "nickname": "voxels",
        "ghType": "Generic Data",
        "access": "item",
        "optional": false,
        "mapping": "None",
        "defaults": []
      },
      {
        "index": 1,
        "name": "Output Voxel Positions",
        "nickname": "voxelPosition",
        "ghType": "Point",
        "access": "list",
        "optional": false,
        "mapping": "None",
        "defaults": []
      },
      {
        "index": 2,
        "name": "Output Voxel Indices",
        "nickname": "voxelIndex",
        "ghType": "Integer",
        "access": "list",
        "optional": false,
        "mapping": "None",
        "defaults": []
      }
    ]
  }
}
