{
  "$schema": "../component.schema.json",
  "schemaVersion": 1,
  "pluginVersion": "4.1.0.0",
  "ghaSha256": "700C1620FD839DD1511E67359961787C8EC08EA595812B2EDED27828F96800C5",
  "component": {
    "name": "Particle Trail Settings",
    "category": "Nuclei4",
    "subcategory": " Particles",
    "componentGuid": "cd0bb03c-2b66-4dbb-864e-02015f0255e7",
    "dotnetType": "Nuclei4.Particle_Settings_Trail",
    "inputs": [
      {
        "index": 0,
        "name": "Trail Size",
        "nickname": "trailSize",
        "ghType": "Integer",
        "access": "item",
        "optional": true,
        "mapping": "None",
        "defaults": [
          "5"
        ]
      }
    ],
    "outputs": [
      {
        "index": 0,
        "name": "Trail Settings",
        "nickname": "trailSettings",
        "ghType": "Text",
        "access": "list",
        "optional": false,
        "mapping": "None",
        "defaults": []
      }
    ]
  }
}
