{
  "$schema": "../component.schema.json",
  "schemaVersion": 1,
  "pluginVersion": "4.1.0.0",
  "ghaSha256": "700C1620FD839DD1511E67359961787C8EC08EA595812B2EDED27828F96800C5",
  "component": {
    "name": "Voxel Selection Intersection",
    "category": "Nuclei4",
    "subcategory": " Environment",
    "componentGuid": "e1c26fa2-35ea-4c83-8f1b-df7d90280196",
    "dotnetType": "Nuclei4.Voxels_AND",
    "inputs": [
      {
        "index": 0,
        "name": "Voxel",
        "nickname": "V1",
        "ghType": "Generic Data",
        "access": "item",
        "optional": false,
        "mapping": "None",
        "defaults": []
      },
      {
        "index": 1,
        "name": "Voxel",
        "nickname": "V2",
        "ghType": "Generic Data",
        "access": "item",
        "optional": false,
        "mapping": "None",
        "defaults": []
      }
    ],
    "outputs": [
      {
        "index": 0,
        "name": "Output Voxels",
        "nickname": "voxels",
        "ghType": "Generic Data",
        "access": "item",
        "optional": false,
        "mapping": "None",
        "defaults": []
      }
    ]
  }
}
