{
  "$schema": "../component.schema.json",
  "schemaVersion": 1,
  "pluginVersion": "4.1.0.0",
  "ghaSha256": "700C1620FD839DD1511E67359961787C8EC08EA595812B2EDED27828F96800C5",
  "component": {
    "name": "Voxel Preview",
    "category": "Nuclei4",
    "subcategory": "Preview",
    "componentGuid": "fb2ea9fc-5963-4587-b09b-0422f61174db",
    "dotnetType": "Nuclei4.Preview_Voxel",
    "inputs": [
      {
        "index": 0,
        "name": "Voxels",
        "nickname": "voxels",
        "ghType": "Generic Data",
        "access": "item",
        "optional": false,
        "mapping": "None",
        "defaults": []
      },
      {
        "index": 1,
        "name": "Type",
        "nickname": "type",
        "ghType": "Integer",
        "access": "item",
        "optional": false,
        "mapping": "None",
        "defaults": [
          "0"
        ]
      },
      {
        "index": 2,
        "name": "Minimum Treshold",
        "nickname": "min",
        "ghType": "Number",
        "access": "item",
        "optional": true,
        "mapping": "None",
        "defaults": [
          "0"
        ]
      },
      {
        "index": 3,
        "name": "Maximum Treshold",
        "nickname": "max",
        "ghType": "Number",
        "access": "item",
        "optional": true,
        "mapping": "None",
        "defaults": [
          "1"
        ]
      },
      {
        "index": 4,
        "name": "Colour",
        "nickname": "colour",
        "ghType": "Colour",
        "access": "item",
        "optional": true,
        "mapping": "None",
        "defaults": [
          "0,0,0 (0)"
        ]
      }
    ],
    "outputs": []
  }
}
