{
  "$schema": "../component.schema.json",
  "schemaVersion": 1,
  "pluginVersion": "4.1.0.0",
  "ghaSha256": "700C1620FD839DD1511E67359961787C8EC08EA595812B2EDED27828F96800C5",
  "component": {
    "name": "Particle Division Settings",
    "category": "Nuclei4",
    "subcategory": " Particles",
    "componentGuid": "7e505abb-dc4f-4226-a922-f92e25ab70da",
    "dotnetType": "Nuclei4.Particle_Settings_Division",
    "inputs": [
      {
        "index": 0,
        "name": "Divide",
        "nickname": "divide",
        "ghType": "Boolean",
        "access": "item",
        "optional": false,
        "mapping": "None",
        "defaults": [
          "False"
        ]
      },
      {
        "index": 1,
        "name": "Minimum Age",
        "nickname": "minAge",
        "ghType": "Integer",
        "access": "item",
        "optional": false,
        "mapping": "None",
        "defaults": [
          "10"
        ]
      },
      {
        "index": 2,
        "name": "Division Range",
        "nickname": "divRange",
        "ghType": "Integer",
        "access": "item",
        "optional": false,
        "mapping": "None",
        "defaults": [
          "3"
        ]
      },
      {
        "index": 3,
        "name": "Minimum Neighbours",
        "nickname": "minN",
        "ghType": "Integer",
        "access": "item",
        "optional": false,
        "mapping": "None",
        "defaults": [
          "0"
        ]
      },
      {
        "index": 4,
        "name": "Maximum Neighbours",
        "nickname": "maxN",
        "ghType": "Integer",
        "access": "item",
        "optional": false,
        "mapping": "None",
        "defaults": [
          "10"
        ]
      },
      {
        "index": 5,
        "name": "Frequency",
        "nickname": "divFrequency",
        "ghType": "Integer",
        "access": "item",
        "optional": false,
        "mapping": "None",
        "defaults": [
          "5"
        ]
      }
    ],
    "outputs": [
      {
        "index": 0,
        "name": "Division Settings",
        "nickname": "divSettings",
        "ghType": "Text",
        "access": "list",
        "optional": false,
        "mapping": "None",
        "defaults": []
      }
    ]
  }
}
