{
  "$schema": "../component.schema.json",
  "schemaVersion": 1,
  "pluginVersion": "4.1.0.0",
  "ghaSha256": "700C1620FD839DD1511E67359961787C8EC08EA595812B2EDED27828F96800C5",
  "component": {
    "name": "Particle Preview",
    "category": "Nuclei4",
    "subcategory": "Preview",
    "componentGuid": "60649521-0784-4a2e-8dfa-27e4a04600ac",
    "dotnetType": "Nuclei4.Preview_Particle",
    "inputs": [
      {
        "index": 0,
        "name": "Particles",
        "nickname": "particles",
        "ghType": "Generic Data",
        "access": "item",
        "optional": false,
        "mapping": "None",
        "defaults": []
      },
      {
        "index": 1,
        "name": "Point Size",
        "nickname": "size",
        "ghType": "Number",
        "access": "item",
        "optional": true,
        "mapping": "None",
        "defaults": [
          "2"
        ]
      }
    ],
    "outputs": []
  }
}
