{
  "$schema": "../component.schema.json",
  "schemaVersion": 1,
  "pluginVersion": "4.1.0.0",
  "ghaSha256": "700C1620FD839DD1511E67359961787C8EC08EA595812B2EDED27828F96800C5",
  "component": {
    "name": "Particle Population Settings",
    "category": "Nuclei4",
    "subcategory": " Particles",
    "componentGuid": "0224814f-9543-481b-9ec0-5f206c39b408",
    "dotnetType": "Nuclei4.Particle_Settings_Population",
    "inputs": [
      {
        "index": 0,
        "name": "Minimum Population",
        "nickname": "minPop",
        "ghType": "Integer",
        "access": "item",
        "optional": true,
        "mapping": "None",
        "defaults": [
          "100"
        ]
      },
      {
        "index": 1,
        "name": "Maximum Population",
        "nickname": "maxPop",
        "ghType": "Integer",
        "access": "item",
        "optional": true,
        "mapping": "None",
        "defaults": [
          "20000"
        ]
      },
      {
        "index": 2,
        "name": "Random Division",
        "nickname": "randomDiv",
        "ghType": "Number",
        "access": "item",
        "optional": true,
        "mapping": "None",
        "defaults": [
          "0"
        ]
      },
      {
        "index": 3,
        "name": "Random Death",
        "nickname": "randomDie",
        "ghType": "Number",
        "access": "item",
        "optional": true,
        "mapping": "None",
        "defaults": [
          "0"
        ]
      },
      {
        "index": 4,
        "name": "Frequency",
        "nickname": "frequency",
        "ghType": "Integer",
        "access": "item",
        "optional": true,
        "mapping": "None",
        "defaults": [
          "1"
        ]
      }
    ],
    "outputs": [
      {
        "index": 0,
        "name": "Population Settings",
        "nickname": "populationSettings",
        "ghType": "Text",
        "access": "list",
        "optional": false,
        "mapping": "None",
        "defaults": []
      }
    ]
  }
}
