{
  "$schema": "../component.schema.json",
  "schemaVersion": 1,
  "pluginVersion": "4.1.0.0",
  "ghaSha256": "700C1620FD839DD1511E67359961787C8EC08EA595812B2EDED27828F96800C5",
  "component": {
    "name": "Voxel Settings Slime",
    "category": "Nuclei4",
    "subcategory": " Environment",
    "componentGuid": "dc1f1c7b-2376-487d-a4ac-d14d9cad856d",
    "dotnetType": "Nuclei4.EnivronmentSettings",
    "inputs": [
      {
        "index": 0,
        "name": "Diffuse Rate",
        "nickname": "diffuse",
        "ghType": "Number",
        "access": "item",
        "optional": true,
        "mapping": "None",
        "defaults": [
          "0.1"
        ]
      },
      {
        "index": 1,
        "name": "Decay Rate",
        "nickname": "decay",
        "ghType": "Number",
        "access": "item",
        "optional": true,
        "mapping": "None",
        "defaults": [
          "0.03"
        ]
      },
      {
        "index": 2,
        "name": "Falloff",
        "nickname": "falloff",
        "ghType": "Number",
        "access": "item",
        "optional": true,
        "mapping": "None",
        "defaults": [
          "0"
        ]
      },
      {
        "index": 3,
        "name": "Diffuse Range",
        "nickname": "range",
        "ghType": "Integer",
        "access": "item",
        "optional": true,
        "mapping": "None",
        "defaults": [
          "1"
        ]
      }
    ],
    "outputs": [
      {
        "index": 0,
        "name": "Voxel Settings",
        "nickname": "voxelSettings",
        "ghType": "Text",
        "access": "list",
        "optional": false,
        "mapping": "None",
        "defaults": []
      }
    ]
  }
}
