{
  "$schema": "../component.schema.json",
  "schemaVersion": 1,
  "pluginVersion": "4.1.0.0",
  "ghaSha256": "700C1620FD839DD1511E67359961787C8EC08EA595812B2EDED27828F96800C5",
  "component": {
    "name": "Extract Voxel Positions",
    "category": "Nuclei4",
    "subcategory": " Environment",
    "componentGuid": "deb55383-1cb3-4b17-8d01-cc05d1b9c635",
    "dotnetType": "Nuclei4.Voxel_Extractor_Point",
    "inputs": [
      {
        "index": 0,
        "name": "Voxels",
        "nickname": "voxels",
        "ghType": "Generic Data",
        "access": "item",
        "optional": false,
        "mapping": "None",
        "defaults": []
      }
    ],
    "outputs": [
      {
        "index": 0,
        "name": "Voxel Positions",
        "nickname": "voxelPosition",
        "ghType": "Point",
        "access": "list",
        "optional": false,
        "mapping": "None",
        "defaults": []
      }
    ]
  }
}
