{
  "$schema": "../component.schema.json",
  "schemaVersion": 1,
  "pluginVersion": "4.1.0.0",
  "ghaSha256": "700C1620FD839DD1511E67359961787C8EC08EA595812B2EDED27828F96800C5",
  "component": {
    "name": "Extract Parent Voxel",
    "category": "Nuclei4",
    "subcategory": "Utility",
    "componentGuid": "f4f3534c-1921-448d-b785-dd0854bc8bed",
    "dotnetType": "Nuclei4.Point_Extractor_ParentVoxel",
    "inputs": [
      {
        "index": 0,
        "name": "Points",
        "nickname": "points",
        "ghType": "Point",
        "access": "tree",
        "optional": false,
        "mapping": "None",
        "defaults": []
      },
      {
        "index": 1,
        "name": "Voxels",
        "nickname": "voxels",
        "ghType": "Generic Data",
        "access": "item",
        "optional": false,
        "mapping": "None",
        "defaults": []
      }
    ],
    "outputs": [
      {
        "index": 0,
        "name": "Point Parent Voxel",
        "nickname": "parentVoxel",
        "ghType": "Number",
        "access": "list",
        "optional": false,
        "mapping": "None",
        "defaults": []
      }
    ]
  }
}
